{
  "feat_ext": {
    "name": "vit",
    "scale_size": 480,
    "patch_size": 8,
    "variant": "base"
  },
  "dataset": {
    "name": "keypoint_dataset",
    "codec": {
      "with_background": true,
      "label_distribution_type": "Gaussian",
      "label_subpix_accurate": true,
      "label_spread": 1.0,
      "decode_method": "topk",
      "decode_top_k": 10
    },
    "save_config": {
      "heatmap_name_pattern": null,
      "marker_name_pattern": null,
      "skeleton_name_pattern": null,
      "labelmap_file_name": null
    },
    "data": {
      "name": "pigeon"
    }
  },
  "evaluator": {
    "num_context": 7,
    "recreate_labels": true
  },
  "label_propagation": {
    "name": "affinity",
    "implementation": "full",
    "affinity_norm": "uvc+softmax",
    "topk_implementation": "full",
    "label_normalization": "none",
    "feature_normalization": true,
    "affinity_topk": 5,
    "neighborhood_size": 5
  }
}