{
  "feat_ext": {
    "name": "uvc",
    "scale_size": 480
  },
  "dataset": {
    "name": "keypoint_dataset",
    "codec": {
      "with_background": true,
      "label_distribution_type": "Gaussian",
      "label_subpix_accurate": true,
      "label_spread": 0.5,
      "decode_method": "topk",
      "decode_top_k": 5
    },
    "save_config": {
      "heatmap_name_pattern": null,
      "marker_name_pattern": null,
      "skeleton_name_pattern": null,
      "labelmap_file_name": "labelmap.npy"
    },
    "data": {
      "name": "jhmdb",
      "split": "test",
      "split_num": 1
    }
  },
  "evaluator": {
    "num_context": 3,
    "recreate_labels": false
  },
  "label_propagation": {
    "name": "affinity",
    "implementation": "full",
    "affinity_norm": "uvc+softmax",
    "topk_implementation": "full",
    "label_normalization": "none",
    "feature_normalization": true,
    "affinity_topk": 20,
    "neighborhood_size": -1
  }
}